{
  "budget_cap_usd": 25.0,
  "flags": [
    "shared_exact_route_resolution",
    "typed_no_content_zero_credit",
    "delayed_open_slot_admission",
    "need_driven_support",
    "lineage_bound_events",
    "typed_failure_continuation",
    "frozen_replay_and_budget_accounting"
  ],
  "goal": "G10R-AB",
  "manifest_id": "G10R-AB-instrumented-integration-pilot-v1",
  "mutable_during_run": false,
  "schema_version": "g10r-ab.1",
  "source_manifest_id": "G10R-AA-fresh-phase-a-acquisition-headroom-v1",
  "source_policy_mode": "frozen_exact_host_read_only"
}
